{
  "$schema": "../../schema/schemas/screen.schema.json",
  "specVersion": 1,
  "id": "screen.plans",
  "name": "PlansScreen",
  "docs": "Collection -> record: a list of plans (search, sort, pager; all state in the URL) and the card of one plan. Data: the Codex fixture `plans`.",
  "source": {
    "collection": "plans",
    "kind": "plan",
    "record": "Plan",
    "fields": {
      "id": "id",
      "name": "title",
      "tagline": "metadata.tagline.value",
      "price": "metadata.price.value",
      "currency": "metadata.currency.value",
      "seats": "metadata.seats.value",
      "storage": "metadata.storage.value",
      "highlighted": "metadata.highlighted.value",
      "features": "metadata.features.value",
      "yearly": "metadata.yearly.value",
      "status": "metadata.plan_status.value"
    }
  },
  "list": {
    "columns": [
      {
        "id": "name",
        "label": "plans.col.name",
        "type": "text",
        "sortable": true
      },
      {
        "id": "price",
        "label": "plans.col.price",
        "type": "money",
        "sortable": true,
        "align": "end"
      },
      {
        "id": "seats",
        "label": "plans.col.seats",
        "type": "number",
        "sortable": true,
        "align": "end"
      },
      {
        "id": "storage",
        "label": "plans.col.storage",
        "type": "number",
        "sortable": true,
        "align": "end"
      },
      {
        "id": "status",
        "label": "plans.col.status",
        "type": "badge"
      }
    ],
    "searchFields": [
      "name",
      "tagline"
    ],
    "pageSize": 5,
    "defaultSort": "price:asc"
  },
  "state": {
    "q": "q",
    "sort": "sort",
    "page": "page"
  },
  "routes": [
    {
      "path": "plans",
      "area": "list"
    },
    {
      "path": "plans/:id",
      "area": "record"
    }
  ],
  "organisms": [
    "PricingCard"
  ],
  "layout": [
    {
      "use": "Block",
      "props": {
        "Tag": "main",
        "ID": "main-content"
      },
      "attrs": {
        "tabindex": -1,
        "data-testid": "main"
      },
      "children": [
        {
          "use": "Container",
          "props": {
            "Class": "mx-auto w-full max-w-6xl px-4 py-8"
          },
          "children": [
            {
              "use": "Stack",
              "props": {
                "Gap": "6"
              },
              "children": [
                {
                  "use": "Group",
                  "props": {
                    "Gap": "4",
                    "Align": "center",
                    "Justify": "between"
                  },
                  "children": [
                    {
                      "use": "Title",
                      "props": {
                        "As": 1,
                        "Size": "2xl",
                        "Weight": "bold"
                      },
                      "children": [
                        {
                          "text": {
                            "$": "ui.app.title"
                          }
                        }
                      ]
                    },
                    {
                      "use": "Button",
                      "props": {
                        "Variant": "outline",
                        "Size": "sm"
                      },
                      "attrs": {
                        "data-testid": "theme-toggle"
                      },
                      "on": {
                        "click": {
                          "call": "actions.toggleTheme",
                          "args": []
                        }
                      },
                      "children": [
                        {
                          "text": {
                            "$": "ui.theme.toggle"
                          }
                        }
                      ]
                    }
                  ]
                },
                {
                  "outlet": true
                }
              ]
            }
          ]
        }
      ]
    }
  ],
  "areas": {
    "list": [
      {
        "use": "Stack",
        "props": {
          "Gap": "4"
        },
        "children": [
          {
            "use": "Group",
            "props": {
              "Gap": "4",
              "Align": "center",
              "Justify": "between",
              "Class": "flex-wrap"
            },
            "children": [
              {
                "use": "Input",
                "props": {
                  "Type": "search",
                  "Size": "default",
                  "Value": {
                    "$": "view.q"
                  },
                  "Placeholder": {
                    "$": "ui.plans.search"
                  },
                  "AriaLabel": {
                    "$": "ui.plans.search"
                  },
                  "Class": "max-w-xs"
                },
                "attrs": {
                  "data-testid": "search"
                },
                "on": {
                  "input": {
                    "call": "actions.search",
                    "args": [
                      {
                        "$": "event.value"
                      }
                    ]
                  }
                }
              },
              {
                "use": "Text",
                "props": {
                  "Size": "sm",
                  "Class": "text-muted-foreground"
                },
                "attrs": {
                  "data-testid": "count"
                },
                "children": [
                  {
                    "text": {
                      "op": "tpl",
                      "args": [
                        {
                          "$": "ui.plans.count"
                        },
                        {
                          "$": "view.total"
                        }
                      ]
                    }
                  }
                ]
              }
            ]
          },
          {
            "use": "Table",
            "props": {
              "Class": "w-full text-sm"
            },
            "attrs": {
              "data-testid": "plans-table"
            },
            "children": [
              {
                "use": "TableCaption",
                "props": {
                  "Class": "sr-only"
                },
                "children": [
                  {
                    "text": {
                      "$": "ui.plans.caption"
                    }
                  }
                ]
              },
              {
                "use": "TableHead",
                "children": [
                  {
                    "use": "TableRow",
                    "children": [
                      {
                        "when": {
                          "op": "and",
                          "args": [
                            {
                              "op": "eq",
                              "args": [
                                {
                                  "$": "view.sort.field"
                                },
                                "name"
                              ]
                            },
                            {
                              "op": "eq",
                              "args": [
                                {
                                  "$": "view.sort.dir"
                                },
                                "asc"
                              ]
                            }
                          ]
                        },
                        "then": [
                          {
                            "use": "TableHeadCell",
                            "props": {
                              "Scope": "col",
                              "Class": ""
                            },
                            "attrs": {
                              "aria-sort": "ascending"
                            },
                            "children": [
                              {
                                "use": "Button",
                                "props": {
                                  "Variant": "ghost",
                                  "Size": "sm",
                                  "Class": "-mx-2 px-2"
                                },
                                "on": {
                                  "click": {
                                    "call": "actions.sort",
                                    "args": [
                                      "name"
                                    ]
                                  }
                                },
                                "children": [
                                  {
                                    "text": {
                                      "$": "ui.plans.col.name"
                                    }
                                  }
                                ]
                              }
                            ]
                          }
                        ],
                        "else": [
                          {
                            "when": {
                              "op": "and",
                              "args": [
                                {
                                  "op": "eq",
                                  "args": [
                                    {
                                      "$": "view.sort.field"
                                    },
                                    "name"
                                  ]
                                },
                                {
                                  "op": "eq",
                                  "args": [
                                    {
                                      "$": "view.sort.dir"